{"audio_sha512":"3bea17e945f51edd0976930dcb22dd5f2d5ce76c4cf65239a03fd25de6f3d6c66a974ab3bf6594bb02d7bdc9485523b25ec22567d078030f4bea8bb59ab1a91d","channels":1,"frames":140160,"reference_artifact_id":"local-jttw-reference-2","reference_audio_artifact_id":"local-jttw-audio-2","sample_rate":24000,"speaker_id":"jttw_narrator","text":"太阳、月亮、天空和大地，都对这块石头施展着魔法。","translation_artifact_id":"local-jttw-translation-2","unit_id":"jttw-2"}
