{"audio_sha512":"cd43df3933b3d3da2527beda10bee794adbc07899b55f6bd54d39a67db2c326fa6af775fbe4774a4609ed8e3e2da34d80cd88a7f2e2ac4cd38e8c720965fc16f","channels":1,"frames":135360,"reference_artifact_id":"local-jttw-reference-1","reference_audio_artifact_id":"local-jttw-audio-1","sample_rate":24000,"speaker_id":"jttw_narrator","text":"很久很久以前，一块石头高高地立在山顶上。","translation_artifact_id":"local-jttw-translation-1","unit_id":"jttw-1"}
