{"audio_sha512":"2e921a9eaf666becdf8bb73adbb37fec96d2f92b8b912aa2c84efaaaa54888b9b8ce085dcb24c72ee44e30f05fbf473f654f995456e3d400a3d5120dc0f00f5f","channels":1,"frames":74880,"reference_artifact_id":"local-jttw-reference-3","reference_audio_artifact_id":"local-jttw-audio-3","sample_rate":24000,"speaker_id":"jttw_narrator","text":"一天，石头裂开了。","translation_artifact_id":"local-jttw-translation-3","unit_id":"jttw-3"}
